### ISSUE TITLE
rtsp playback with mpv (ffmpeg demuxer) fails and halts stream

### ISSUE THREAD

**Issue by molo1134** [EliasKotlyar/Xiaomi-Dafang-Hacks#983]
* exact camera hardware: wyzecam v2
* the Xiaomi-Dafang-Hacks commitid (from `git log`) you are experiencing the issue with: commit c7451624acb4bddbff2aaa7dfcb6238064bfef7c (master)

### Description

During playback of rtsp h264 stream over wlan, stream terminates with ffmpeg demux error, and 400/501 errors in packet capture.  Error reported is `CSeq 6 expected, 0 received.`.

```
$ mpv rtsp://cam1.lan:8554/unicast
Playing: rtsp://cam1.lan:8554/unicast
[ffmpeg/audio] mp3: Header missing
 (+) Video --vid=1 (h264 640x360 15.000fps)
 (+) Audio --aid=1 (mp3 1ch 16000Hz)
File tags:
 Comment: LIVE555 Streaming Media v2017.10.28
 Title: LIVE555 Streaming Media v2017.10.28
[ffmpeg/audio] mp3: Header missing
Error decoding audio.
AO: [alsa] 48000Hz mono 1ch s16
VO: [vdpau] 640x360 yuv420p
Invalid video timestamp: 0.411244 -> 0.107044
AV: 00:00:04 / 00:00:00 A-V: -0.001 ct:  0.307 Cache:  1s
Invalid audio PTS: 4.393800 -> 3.318033
AV: 00:00:04 / 00:00:00 A-V: -0.001 ct:  0.307 Cache:  1s

Audio/Video desynchronisation detected! Possible reasons include too slow
hardware, temporary CPU spikes, broken drivers, and broken files. Audio
position will not match to the video (see A-V status field).

AV: 00:00:20 / 00:00:00 A-V: -0.001 ct: -0.802 Cache:  1s
[ffmpeg/video] h264: Increasing reorder buffer to 1
(Buffering) AV: 00:00:58 / 00:00:00 A-V:  0.020 ct: -0.769 Cache:  0s
[ffmpeg/demuxer] rtsp: CSeq 6 expected, 0 received.
(Buffering) AV: 00:00:58 / 00:00:00 A-V:  0.020 ct: -0.769 Cache:  0s


Exiting... (Quit)
```

Packet capture showing 400/501 errors:

```
10072 69.631048998  xxx.xxx.x.2 → xxx.xxx.x.27 TCP 66 44120 → 8554 [ACK] Seq=740 Ack=8668294 Win=852992 Len=0 TSval=800351196 TSecr=5892386
10073 69.886458295 xxx.xxx.x.27 → xxx.xxx.x.2  TCP 70 8554 → 44120 [PSH, ACK] Seq=8668294 Ack=740 Win=16624 Len=4 TSval=5892411 TSecr=800351196 [TCP segment of a reassembled PDU]
10074 69.886501464  xxx.xxx.x.2 → xxx.xxx.x.27 TCP 66 44120 → 8554 [ACK] Seq=740 Ack=8668298 Win=852992 Len=0 TSval=800351452 TSecr=5892411
10075 70.017889613 xxx.xxx.x.27 → xxx.xxx.x.2  RTCP 110 Sender Report   Source description   
10076 70.017914254  xxx.xxx.x.2 → xxx.xxx.x.27 TCP 66 44120 → 8554 [ACK] Seq=740 Ack=8668342 Win=852992 Len=0 TSval=800351583 TSecr=5892422
10077 70.208376696 xxx.xxx.x.27 → xxx.xxx.x.2  RTCP 1322 PT=MPEG-I/II Audio, SSRC=0xE7212DE3, Seq=6766, Time=4056506637, Sender Report   Source description   
10078 70.208422395  xxx.xxx.x.2 → xxx.xxx.x.27 TCP 66 44120 → 8554 [ACK] Seq=740 Ack=8669598 Win=852992 Len=0 TSval=800351773 TSecr=5892445
10079 71.074505272 xxx.xxx.x.27 → xxx.xxx.x.2  RTP 1281 [TCP Previous segment not captured] PT=MPEG-I/II Audio, SSRC=0xE7212DE3, Seq=6768, Time=4056578828
10080 71.074537720  xxx.xxx.x.2 → xxx.xxx.x.27 TCP 78 [TCP Dup ACK 10078#1] 44120 → 8554 [ACK] Seq=740 Ack=8669598 Win=852992 Len=0 TSval=800352640 TSecr=5892445 SLE=8670810 SRE=8672025
10081 71.144553688 xxx.xxx.x.27 → xxx.xxx.x.2  TCP 1278 [TCP Retransmission] 8554 → 44120 [PSH, ACK] Seq=8669598 Ack=740 Win=16624 Len=1212 TSval=5892537 TSecr=800352640
10082 71.144628345  xxx.xxx.x.2 → xxx.xxx.x.27 TCP 66 44120 → 8554 [ACK] Seq=740 Ack=8672025 Win=851968 Len=0 TSval=800352710 TSecr=5892537
10083 71.149600513  xxx.xxx.x.2 → xxx.xxx.x.27 RTSP 98 Reply: RTSP/1.0 501 Not Implemented
10084 71.193179868 xxx.xxx.x.27 → xxx.xxx.x.2  TCP 66 8554 → 44120 [ACK] Seq=8672025 Ack=772 Win=16624 Len=0 TSval=5892541 TSecr=800352715
10085 71.193218896 xxx.xxx.x.27 → xxx.xxx.x.2  RTSP 217 Reply: RTSP/1.0 400 Bad Request
10086 71.193791327  xxx.xxx.x.2 → xxx.xxx.x.27 RTSP 98 Reply: RTSP/1.0 501 Not Implemented
10087 71.273485121 xxx.xxx.x.27 → xxx.xxx.x.2  RTSP 217 Reply: RTSP/1.0 400 Bad Request
10088 71.317038787  xxx.xxx.x.2 → xxx.xxx.x.27 TCP 66 44120 → 8554 [ACK] Seq=804 Ack=8672327 Win=854016 Len=0 TSval=800352882 TSecr=5892545
```
Note: .2 is the rtsp client, .27 is the camera.

### Configuration:

```
# grep ^[A-Z] config/rtspserver.conf
PORT=8554
RTSPH264OPTS="-W640 -H360"
RTSPMJPEGOPTS="-W640 -H360"
BITRATE=5000
FRAMERATE_DEN=1
FRAMERATE_NUM=15
VIDEOFORMAT=2
AUDIOFORMAT=MP3
AUDIOINBR=16000
AUDIOOUTBR=16000
HWVOLUME=70
SWVOLUME=-1
FILTER=4
HIGHPASSFILTER=true
AECFILTER=true
FLIP=ON
USERNAME=
USERPASSWORD=
```

**Comment by molo1134** [comment]
Similar issues: #674 #667
